<?xml version="1.0" encoding="UTF-8"?>
<?xml-stylesheet href="/xsl/project.xsl" type="text/xsl"?>
<?xml-stylesheet href="/xsl/guide.xsl" type="text/xsl"?>
<!DOCTYPE project SYSTEM "/dtd/project.dtd">
<project>
  <name>Gentoo PowerPC</name>
  <longname>Gentoo Linux PowerPC Development</longname>
  <date>2010-01-22</date>

  <description>
    The Gentoo/PowerPC Project supports and maintains Gentoo Linux on the PowerPC
    architecture, for both the 32 bit and 64 bit userlands.
  </description>

  <longdescription>
  
    <p>The Gentoo/PowerPC Project works to ensure that Gentoo is the most up to 
    date and robust PowerPC distribution available for both server and desktop 
    applications.</p> 

    <p>Bugs are tracked and resolved from the 
    <uri link="http://bugs.gentoo.org">Gentoo bug tracker</uri>.  For PowerPC
    bugs, please see this <uri link="https://bugs.gentoo.org/buglist.cgi?query_format=&amp;short_desc_type=allwordssubstr&amp;short_desc=&amp;long_desc_type=substring&amp;long_desc=&amp;bug_file_loc_type=allwordssubstr&amp;bug_file_loc=&amp;keywords_type=allwords&amp;keywords=&amp;bug_status=NEW&amp;bug_status=ASSIGNED&amp;bug_status=REOPENED&amp;emailassigned_to1=1&amp;emailtype1=exact&amp;email1=ppc%40gentoo.org&amp;emailassigned_to2=1&amp;emailreporter2=1&amp;emailqa_contact2=1&amp;emailcc2=1&amp;emailtype2=substring&amp;email2=&amp;bugidtype=include&amp;bug_id=&amp;votes=&amp;changedin=&amp;chfieldfrom=&amp;chfieldto=Now&amp;chfieldvalue=&amp;cmdtype=doit&amp;order=Reuse+same+sort+as+last+time&amp;field0-0-0=noop&amp;type0-0-0=noop&amp;value0-0-0=">link</uri>. 
    Correspondence is maintained on the PowerPC related mailing lists,
    gentoo-ppc-user and gentoo-ppc-dev.  For more information on PowerPC mailing
    lists, please see <uri link="http://www.gentoo.org/main/en/lists.xml"> the
    Gentoo Mailing list overview</uri>. Additionally, the PowerPC team is almost
    always available in #gentoo-powerpc on 
    <uri link="http://freenode.net">freenode</uri>.</p>
    
  </longdescription>

  <goals>
  
    <p>The goal of the Gentoo PowerPC development project is to guarantee that
    the PowerPC packages built using Gentoo meta-data (ebuilds) are functional 
    and up to date.  By continuously testing new packages, maintaining 
    existing packages and providing user support, the Gentoo PowerPC team 
    provides the PowerPC user with a modern distro based on community, 
    performance and freedom.  Utilizing Gentoo's meta-data based distribution 
    allows a user to to be as bleeding edge or as conservative as is desired.
    </p>

    <p>Gentoo is unique because all of its supported architectures share the 
    same generic meta-data information (ebuilds) which describe how to build 
    packages.  These packages are combined to form the foundation of this 
    distribution.  The PowerPC developers are responsible for building and 
    testing ebuilds and marking them as tested (~ppc/~ppc64) or stable 
    (ppc/ppc64). Our users can use this information, along with the portage
    application, to build a system that suits their needs, whether it is a
    stable server, embedded system or a bleeding edge desktop system.</p>

  </goals>

  <subproject ref="/proj/en/base/ppc/doc.xml"/>

  <dev role="Developer" description="Gentoo/PPC">josejx</dev>
  <dev role="Developer" description="Gentoo/PPC">nixnut</dev>
  <dev role="Developer" description="Gentoo/PPC">volkmar</dev>

  <dev role="Developer" description="Gentoo/PPC64">tgall</dev>
  <dev role="Developer" description="Gentoo/PPC64">josejx</dev>
  <dev role="Developer" description="Gentoo/PPC64">ranger</dev>

  <extrachapter position="bottom">
    <title>How to Participate</title>
    <section>
      <body>

        <p>Can you make computers do amazing things? Are you excited about
        exploring areas of computing never explored before? We are continuously
        looking for volunteers willing to spend some of their free time on this
        project.</p>

        <p>If you are interested in helping, but don't have a niche that you are
        interested in filling, you can always look through our 
	<uri link="https://bugs.gentoo.org/buglist.cgi?query_format=&amp;short_desc_type=allwordssubstr&amp;short_desc=&amp;long_desc_type=substring&amp;long_desc=&amp;bug_file_loc_type=allwordssubstr&amp;bug_file_loc=&amp;keywords_type=allwords&amp;keywords=&amp;bug_status=NEW&amp;bug_status=ASSIGNED&amp;bug_status=REOPENED&amp;emailassigned_to1=1&amp;emailtype1=exact&amp;email1=ppc%40gentoo.org&amp;emailassigned_to2=1&amp;emailreporter2=1&amp;emailqa_contact2=1&amp;emailcc2=1&amp;emailtype2=substring&amp;email2=&amp;bugidtype=include&amp;bug_id=&amp;votes=&amp;changedin=&amp;chfieldfrom=&amp;chfieldto=Now&amp;chfieldvalue=&amp;cmdtype=doit&amp;order=Reuse+same+sort+as+last+time&amp;field0-0-0=noop&amp;type0-0-0=noop&amp;value0-0-0=">bugs</uri>. There are always 
	packages that need to be tested, bugs waiting to be found and fixed 
	and enhancements waiting for someone to code them. Feel free to 
	ask the PPC development team on IRC what <e>you</e> can help us with!
	</p>

        <p>for more information on how the PPC team recruits please read our
	<uri link="recruitment.xml">recruitment</uri> page.
        </p>

      </body>
    </section>
  </extrachapter>

<herd name="ppc"/>
<herd name="ppc64"/>

</project>
