<?xml version='1.0' encoding="UTF-8"?>
<!-- $Header: /var/cvsroot/gentoo/xml/htdocs/proj/en/pr/events/clt2008-germany/index.xml,v 1.1 2007/12/09 21:32:16 dertobi123 Exp $ -->
<?xml-stylesheet href="/xsl/project.xsl" type="text/xsl"?>
<?xml-stylesheet href="/xsl/guide.xsl" type="text/xsl"?>
<!DOCTYPE project SYSTEM "/dtd/project.dtd">

<project>
  <name>clt2008-germany</name>
  <longname>Chemnitzer Linuxtage 2008</longname>
  <date>2007-12-09</date>
  <author title="Contact">
    <mail link="dertobi123@gentoo.org">Tobias Scherbaum</mail>
  </author>

  <description>
  This subproject is a place to hold informations on organizing the Gentoo booth
  at the Chemnitzer Linuxtage 2008.
  </description>

  <longdescription>
  <p>
  Gentoo will be present at the Chemnitzer Linuxtage 2008 for the fifth
  time. The event takes place on 1th and 2nd March 2008. Deadline to submit
  talks and projects is January 3, 2008. Our attendance is not confirmed
  yet.
  </p>
  </longdescription>

  <goals>
  <ul>
    <li>Poster</li>
    <li>Flyer</li>
    <li>probably CDs/DVDs</li>
	<li>maybe an event-box</li>
  </ul>
  </goals>

  <extrachapter>
    <title>Preparing the event</title>
    <section>
      <title>People</title>
      <body>
        <p>This is the list of people related to this event:</p>
          <table>
            <tr>
              <th>Name</th>
              <th>Title</th>
              <th>Function on the booth</th>
              <th>Date of arrival</th>
              <th>Date of departure</th>
              <th>City coming from</th>
              <th>Coming using</th>
              <th>Sleeping in</th>
              <th>Email</th>
              <th>Phone</th>
            </tr>
            <tr>
              <ti>Tobias Scherbaum</ti>
              <ti>Gentoo Developer</ti>
              <ti>Organizational contact, booth staff</ti>
              <ti>29th February late evening via LEJ</ti>
              <ti>4th March evening via LEJ</ti>
              <ti>Oberhausen, Germany</ti>
              <ti>plane</ti>
              <ti> ?? </ti>
              <ti>dertobi123@gentoo.org</ti>
              <ti>+49 172 7307110</ti>
            </tr>
            <tr>
              <ti>Robert Buchholz</ti>
              <ti>Gentoo Developer</ti>
              <ti>booth staff</ti>
              <ti></ti>
              <ti></ti>
              <ti>Berlin, Germany</ti>
              <ti> ?? </ti>
              <ti> ?? </ti> 
              <ti>rbu@gentoo.org</ti>
              <ti> ?? </ti>
            </tr>
            <tr>
              <ti>Jan Seidel</ti>
              <ti>former Gentoo Developer</ti>
              <ti>booth staff</ti>
              <ti></ti>
              <ti></ti>
              <ti>Altenburg, Germany</ti>
              <ti> ?? </ti>
              <ti> ?? </ti> 
              <ti></ti>
              <ti> ?? </ti>
            </tr>
            <tr>
              <ti>Jens Bl√§sche</ti>
              <ti>Gentoo User</ti>
              <ti>booth staff</ti>
              <ti></ti>
              <ti></ti>
              <ti> ?? </ti>
              <ti> ?? </ti>
              <ti> ?? </ti> 
              <ti> ?? </ti>
            </tr>


          </table>
      </body>
    </section>
  </extrachapter>
</project>
